{"schema_version":1,"workflow_version":"0.1.0","id":"DRAGAI-62","status":"Ready","risk_profile":"standard","included_issues":["DRAGAI-67"],"acceptance":["Runtime installs"],"full_ci_point":"candidate","work_references":[{"repository_full_name":"AlexJJ009/agent-tools","base_branch":"main","base_sha":"1111111111111111111111111111111111111111","working_branch":"linear/dragai-62-contract-validator-foundation","candidate_sha":null,"github_pull_request":null}],"permitted_paths":["linear_workflow/","docs/linear-templates/"],"changed_paths":["linear_workflow/VERSION"],"integration_evidence":null}
