{"schema_version":1,"workflow_version":"0.1.0","id":"DRAGAI-80","status":"Ready","risk_profile":"fast","included_issues":["DRAGAI-81"],"acceptance":["Small fix works"],"full_ci_point":"candidate","work_references":[{"repository_full_name":"AlexJJ009/agent-tools","base_branch":"main","base_sha":"1111111111111111111111111111111111111111","working_branch":"linear/dragai-81-small-fix","candidate_sha":null,"github_pull_request":null}],"permitted_paths":["README.md"],"changed_paths":["README.md"],"integration_evidence":null}
